{
  "$schema": "http://json-schema.org/draft-07/schema#", "$id": "https://agent-flow.invalid/contracts/v1/context-item.schema.json", "title": "ContextItem 1.0", "type": "object", "additionalProperties": false,
  "required": ["schema_version", "item_id", "kind", "source", "relevance", "freshness", "estimated_tokens", "estimator_version", "provenance", "selection_reason", "content_ref"],
  "properties": {"schema_version": {"const": "1.0"}, "item_id": {"$ref": "#/definitions/id"}, "kind": {"enum": ["working", "semantic", "procedural", "episodic", "domain"]}, "source": {"type": "object", "additionalProperties": false, "required": ["uri", "revision", "sha256"], "properties": {"uri": {"type": "string", "pattern": "^[A-Za-z][A-Za-z0-9+.-]*://[^\\s]+(?![\\s\\S])"}, "revision": {"type": "string", "minLength": 1}, "sha256": {"$ref": "#/definitions/hash"}}}, "relevance": {"type": "number", "minimum": 0, "maximum": 1}, "freshness": {"type": "object", "additionalProperties": false, "required": ["checked_at", "status", "source_revision"], "properties": {"checked_at": {"$ref": "#/definitions/timestamp"}, "status": {"enum": ["fresh", "stale", "unknown"]}, "source_revision": {"type": "string", "minLength": 1}}}, "estimated_tokens": {"type": "integer", "minimum": 0}, "estimator_version": {"type": "string", "minLength": 1}, "provenance": {"type": "object", "additionalProperties": false, "required": ["provider", "version", "trust"], "properties": {"provider": {"type": "string", "minLength": 1}, "version": {"type": "string", "minLength": 1}, "trust": {"type": "string", "minLength": 1}}}, "selection_reason": {"type": "string", "minLength": 1}, "content_ref": {"type": "string", "pattern": "^[A-Za-z][A-Za-z0-9+.-]*://[^\\s]+(?![\\s\\S])"}, "extensions": {"type": "object"}},
  "definitions": {"id": {"type": "string", "pattern": "^[A-Za-z0-9][A-Za-z0-9_.-]{0,127}(?![\\s\\S])"}, "hash": {"type": "string", "pattern": "^[0-9a-f]{64}(?![\\s\\S])"}, "timestamp": {"type": "string", "format": "date-time", "pattern": "^\\d{4}-\\d{2}-\\d{2}T\\d{2}:\\d{2}:\\d{2}(?:\\.\\d+)?Z(?![\\s\\S])"}}
}
