{"schema_version":"1.0","item_id":"item-2","kind":"domain","source":{"uri":"artifact://context/2","revision":"r2","sha256":"bbbbbbbbbbbbbbbbbbbbbbbbbbbbbbbbbbbbbbbbbbbbbbbbbbbbbbbbbbbbbbbb"},"relevance":1,"freshness":{"checked_at":"2026-09-18T00:00:00Z","status":"fresh","source_revision":"r2"},"estimated_tokens":1,"estimator_version":"1","provenance":{"provider":"local","version":"1","trust":"reviewed"},"selection_reason":"relevant","content_ref":"artifact://content/2","extensions":{"note":"informative"}}
