{"schema_version":"1.0","item_id":"item-1","kind":"working","source":{"uri":"artifact://context/1","revision":"r1","sha256":"aaaaaaaaaaaaaaaaaaaaaaaaaaaaaaaaaaaaaaaaaaaaaaaaaaaaaaaaaaaaaaaa"},"relevance":0,"freshness":{"checked_at":"2026-09-18T00:00:00Z","status":"unknown","source_revision":"r1"},"estimated_tokens":0,"estimator_version":"1","provenance":{"provider":"local","version":"1","trust":"untrusted"},"selection_reason":"requested","content_ref":"artifact://content/1"}
